País,Categoría,Nombre,Og_Resumida
España,Residencia,Residencia artística en Barcelona,"Residencia artística en Barcelona dirigida a artistas de cualquier nacionalidad, incluyendo latinoamericanos, que deseen desarrollar o profundizar su práctica en un entorno internacional; está abierta a diversas disciplinas artísticas, con énfasis en arte performático. La convocatoria ofrece 1 beca completa y 2 medias becas para participantes de la plataforma Datarte, aunque no se especifica el monto exacto destinado a los seleccionados ni los detalles sobre apoyo financiero adicional. No se menciona la existencia de un pago de inscripción obligatorio para postular."
España,Convocatoria,Experiencia inmersiva en un pueblo de la España Rural,"Dirigida a artistas y creadores de todas las disciplinas interesados en desarrollar un proyecto inmersivo en un pueblo de la España rural, la oportunidad Experiencia inmersiva en un pueblo de la España Rural no requiere pago de inscripción, contempla artes visuales, escénicas, música, literatura, audiovisuales, diseño y otras expresiones culturales, y ofrece a los seleccionados una residencia artística con alojamiento, manutención y un estipendio de 500 euros para producción; la convocatoria está abierta a postulantes internacionales, incluyendo artistas de Latinoamérica."
México,Convocatoria,Concurso  para Artistas Emergentes 2025 📲,"The art project es un proyecto creado por artistas y para artistas; nuestro objetivo es fomentar la visibilidad y el desarrollo de artistas emergentes a través de una plataforma que celebre la creatividad, innovación y diversidad en las artes visuales sin importar edad o preparación académica , ya que sabemos que nunca es tarde para empezar en el arte y que hay mucho talento nato y autodidacta allá fuera queriendo ser visto ¿Quiénes pueden participar?
- Artistas en las primeras etapas de su carrera con o sin formación académica pero tu estilo debe ser único
- Mayores de 18 años y no hay limite de edad
- Residencia en México (sin importar nacionalidad )
- Disciplinas visuales : pintura, dibujo, fotografía, escultura"
Bélgico,Convocatoria,Razor Reel Flanders Film Festival (member of the MIFF),"Razor Reel Flanders Film Festival (member of the MIFF) está dirigido a cineastas de todo el mundo que deseen presentar cortometrajes y largometrajes de género fantástico, terror, ciencia ficción y thriller. La inscripción requiere el pago de una tasa, cuyo monto varía según la fecha y la categoría de la obra presentada; la información sobre el monto exacto debe consultarse en la página de inscripción, ya que puede actualizarse anualmente y no figura explícitamente en la descripción general. No se especifica un premio monetario para los seleccionados o ganadores, ni se mencionan estipendios directos para artistas; los premios suelen ser de reconocimiento y exhibición dentro del festival. La convocatoria está abierta a participantes internacionales, incluyendo artistas de Latinoamérica, sin restricciones geográficas señaladas."
España,Convocatoria,LesGaiCineMad Madrid International LGBTI+ Film Festival,"El LesGaiCineMad Madrid International LGBTI+ Film Festival está dirigido a cineastas, productores y realizadores de cualquier nacionalidad, sin restricción geográfica explícita, por lo que pueden participar artistas de Latinoamérica; la convocatoria abarca obras cinematográficas de temática LGBTI+ en todas las disciplinas del cine (largometrajes, cortometrajes, documentales, animación, etc.). Para participar es obligatorio pagar una tasa de inscripción cuyo monto varía según la categoría y el periodo de inscripción, generalmente entre 8 y 30 euros aproximadamente, y no se mencionan exenciones para artistas latinoamericanos. No se especifica en las bases un monto de premio económico para los ganadores, ya que el reconocimiento principal consiste en la exhibición de las obras y la obtención de galardones y diplomas, aunque en algunas ediciones pueden otorgarse premios adicionales no garantizados; se recomienda revisar la página oficial del festival para confirmar si hay premios en metálico en la convocatoria vigente."
Brasil,Convocatoria,Curta-Se Festival Iberoamericano de Cinema de Sergipe,"Curta-SE 24 busca facilitar al público de Sergipe el acceso y la difusión de las producciones audiovisuales iberoamericanas, fomentar el intercambio entre cineastas brasileños e iberoamericanos y educar al público sobre el cine brasileño. También busca promover la accesibilidad, la economía creativa y la sostenibilidad en las ciudades. El Festival se compone de las siguientes secciones: Cine Digital Iberoamericano: Películas realizadas por productores y/o directores iberoamericanos o residentes en Brasil durante más de dos años, finalizadas entre 2023 y 2025, pueden participar en las siguientes categorías: a) Cortometraje Iberoamericano: hasta 15 minutos de duración, 
b) Cortometraje Sergipe
c) Video de Bolsillo: hasta 4 minutos de duración; producido con un teléfono celular o cámara digital;
d) Video Musical: hasta 4 minutos de duración; hasta 10 obras seleccionadas;
e) Tráiler: hasta 4 minutos de duración; Hasta 5 obras seleccionadas;
f) Serie web: hasta 10 minutos de duración; hasta 5 obras seleccionadas.
g) Largometraje: de 70 minutos o más, en formato digital, finalizado entre 2023 y 2025; hasta 5 películas seleccionadas.
"
Chile,Convocatoria,Viña del Mar International Film Festival,"El Viña del Mar International Film Festival está dirigido a cineastas de todo el mundo, incluyendo América Latina, interesados en enviar cortometrajes, largometrajes, documentales, animaciones, guiones y obras audiovisuales de diversos géneros. La convocatoria requiere el pago de una cuota de inscripción, cuyo monto específico debe consultarse al realizar la postulación, y dicha cuota no es reembolsable. La disciplina principal es el cine en todas sus formas, incluyendo propuestas artísticas audiovisuales y musicales. El festival otorga premios en efectivo, siendo el monto principal de 11.000 euros para la categoría principal, aunque pueden existir otros premios según la sección o competencia. La oportunidad está abierta a artistas latinoamericanos sin restricciones geográficas explícitas en la elegibilidad."
México,Convocatoria,Espanto Film Fest,"Espanto Film Fest está dirigido a cineastas de todo el mundo que presenten cortometrajes y largometrajes dentro de los géneros de terror, fantástico y ciencia ficción. La convocatoria requiere el pago de una tasa de inscripción, cuyo monto varía según la fecha y la categoría de la obra; por ejemplo, el coste para cortometrajes internacionales puede ser de aproximadamente 6 € y para largometrajes 10 €, aunque estos valores pueden cambiar y se recomienda verificar en la plataforma antes de enviar la obra. No se especifican premios monetarios para los seleccionados o ganadores; los premios consisten principalmente en trofeos y menciones. La oportunidad está abierta a participantes de Latinoamérica y no existen restricciones geográficas para postular, siempre que las obras cumplan con las temáticas y los requisitos técnicos establecidos en las bases."
Chile,Convocatoria,Santiago Horror Film Festival,"Santiago Horror Film Festival está dirigido a cineastas de todo el mundo que trabajen en los géneros de terror, fantasía y ciencia ficción, aceptando tanto cortometrajes como largometrajes y videoclips relacionados con estos géneros. La oportunidad requiere el pago de una tasa de inscripción que varía según la categoría y el momento de envío, y aunque se aceptan obras de cualquier país, la convocatoria está explícitamente abierta a participantes internacionales, incluyendo artistas de Latinoamérica. No se especifica en la información pública un monto de premio económico destinado a los artistas seleccionados o ganadores; los detalles sobre premios monetarios, si existen, deberían confirmarse revisando las bases oficiales completas del festival, ya que no están disponibles de forma clara en la descripción principal."
España,Convocatoria,Convocatoria Residencias artísticas 2025-26 en el C3A,"Dirigida a artistas con trayectoria profesional demostrable en creación contemporánea, la Convocatoria Residencias artísticas 2025-26 en el C3A ofrece residencias de tres meses en dos periodos posibles (marzo-mayo o septiembre-noviembre), con ayudas de hasta 7.000 euros para los seleccionados; no se menciona pago de inscripción para participar. Están abiertas a diversas disciplinas vinculadas al arte contemporáneo y requieren la presentación de un proyecto concreto y viable. La información disponible no especifica restricciones geográficas, por lo que se asume que artistas de Latinoamérica pueden postular."
Argentina,Convocatoria,Convocatoria para proyectos MUTEK Argentina 2025,"La Convocatoria para proyectos MUTEK Argentina 2025 está dirigida a artistas, colectivos y creadores vinculados a la creatividad digital y la música electrónica, incluyendo disciplinas como performances audiovisuales, instalaciones interactivas, experiencias XR y proyectos experimentales con componentes tecnológicos; pueden postular personas de Argentina y de otros países latinoamericanos. No se menciona el cobro de ningún pago o arancel de inscripción para participar. La información disponible no especifica un monto económico destinado a los artistas seleccionados o ganadores."
Ecuador,Convocatoria,Convocatoria abierta Proyectos curatoriales,"Dirigida a curadores/as e investigadores/as con proyectos expositivos que incluyan al menos dos artistas, la Convocatoria abierta Proyectos curatoriales de Q Galería seleccionará tres propuestas para integrar su agenda expositiva 2026-2027; está destinada exclusivamente a personas ecuatorianas o extranjeras residentes en Ecuador, por lo que no está abierta a artistas que residan en otros países de Latinoamérica. No se menciona ningún pago de inscripción para participar. Las disciplinas artísticas involucradas son artes visuales contemporáneas, especialmente aquellas vinculadas a género, ecologías, territorio, archivo, identidad y migración. No se especifica ningún monto de dinero destinado a los proyectos seleccionados ni honorarios para curadores o artistas; la información disponible no detalla apoyos económicos, producción ni estipendios asociados."
México,Beca,AMEXCID ofrece becas en México para estudiantes extranjeros,"Dirigida a estudiantes extranjeros interesados en realizar estudios de licenciatura, maestría, doctorado e investigaciones de posgrado en México, la convocatoria de la AMEXCID ofrece becas que cubren disciplinas académicas y artísticas, incluyendo artes visuales, música, teatro, cine y literatura; la oportunidad está abierta para postulantes de América Latina y el Caribe, entre otras regiones. No se requiere pago de inscripción para participar. Los beneficios incluyen estipendios mensuales (el monto varía según el nivel de estudios, por ejemplo, aproximadamente $12,614 MXN para maestría y $15,768 MXN para doctorado), inscripción y colegiatura en la institución receptora, seguro médico, apoyo para transporte internacional y nacional, y exención de costos de visado."
España,Premio,Premio Nadal de Novela abre su convocatoria 2026,"Dirigido a escritores mayores de edad de cualquier nacionalidad que presenten una novela original, inédita y escrita en castellano, el Premio Nadal de Novela abre su convocatoria 2026 sin requerir pago de inscripción; la disciplina involucrada es exclusivamente la novela literaria, y la obra ganadora recibirá 30.000 euros como anticipo por la cesión de derechos de edición, con publicación en España y Latinoamérica; pueden participar autores de Latinoamérica siempre que cumplan con los requisitos formales de la convocatoria."
España,Convocatoria,CORTÓPOLIS Festival Latinoamericano de Cortometrajes 2025,"Dirigida a realizadores y realizadoras latinoamericanos mayores de edad, la convocatoria del CORTÓPOLIS Festival Latinoamericano de Cortometrajes 2025 acepta cortometrajes de todos los géneros y estilos, incluyendo ficción, documental, animación y experimental; no se menciona ningún pago de inscripción para participar ni se detallan montos de premios económicos para los seleccionados o ganadores en la información disponible. La oportunidad está abierta exclusivamente a artistas de Latinoamérica, y los trabajos podrán presentarse entre el 26 de julio y el 26 de agosto de 2025 a través de la plataforma indicada por el festival. Falta información específica sobre premios en dinero y otros beneficios para los participantes."
China,Premio,Better Design Award (BDA) 2025 concurso internacional de diseño,"Dirigida a empresas, agencias de diseño, diseñadores, universidades, individuos o equipos de cualquier país o región del mundo, incluido Latinoamérica; la convocatoria Better Design Award (BDA) 2025 es un concurso internacional enfocado en diseño de producto, diseño para la industria y, como novedad este año, una categoría especial en IA y robótica. La participación no requiere pago de inscripción. El monto total en premios es de RMB 4,2 millones (aproximadamente 510.000 euros), distribuidos en más de 300 premios en efectivo para los ganadores; los premios están sujetos a impuestos conforme a la ley china. Pueden postularse tanto productos existentes como conceptos originales, y la convocatoria está abierta hasta el 15 de agosto de 2025."
España,Convocatoria,INAMU Fomento: convocatoria para participar en los showcases de Monkey Week,"Dirigida a músicos argentinos o residentes en Argentina, solistas o agrupaciones, que trabajen en los géneros rock, indie rock, indie pop y urbano, la convocatoria INAMU Fomento para participar en los showcases de Monkey Week (Cádiz, España) seleccionará dos proyectos para presentarse en el evento del 20 al 22 de noviembre de 2025; es requisito estar inscripto en el Registro Único de Artistas Musicales del INAMU y contar con pasaporte y seguro de viaje vigente, no se requiere pago de inscripción, y cada proyecto seleccionado recibirá un caché de €400 y una noche de alojamiento, sin cobertura de pasajes ni gastos adicionales; la oportunidad no está abierta a artistas de otros países de Latinoamérica fuera de Argentina, ya que sólo pueden postular argentinos o residentes en Argentina."
México,Convocatoria,GuadaLAjara Film Festival abre convocatoria para Work In Progress (WIP Latino),"La convocatoria GuadaLAjara Film Festival abre convocatoria para Work In Progress (WIP Latino) está dirigida a cineastas latinxs, latinoamericanos y BIPOC con largometrajes de ficción o documental en etapa de montaje o postproducción que requieran al menos dos procesos de postproducción para su finalización; no pueden participar películas que solo necesiten distribución ni proyectos de estudiantes a tiempo completo. La inscripción es gratuita y se realiza de forma electrónica entre el 18 de junio y el 20 de agosto de 2025. Los proyectos seleccionados podrán acceder a apoyos en servicios profesionales de postproducción (como corrección de color, sonido y distribución) y un premio en efectivo otorgado por la University of Guadalajara Foundation USA, aunque el monto exacto será anunciado antes del festival. La oportunidad está abierta para artistas de Latinoamérica y la diáspora, y no cubre gastos de viaje ni alimentación de los participantes."
EEUU,Convocatoria,City of Napa: Napa Lighted Art Festival 2026 (USA),"Convocatoria internacional dirigida a artistas y colectivos de cualquier país, incluidos latinoamericanos, para presentar instalaciones donde la luz sea el elemento central, abarcando disciplinas como escultura lumínica, arte de luz, videoarte, proyecciones 3D, LED, fibra óptica, gobos personalizados, obras interactivas y láser. La oportunidad corresponde al City of Napa: Napa Lighted Art Festival 2026 (Estados Unidos), que se celebrará del 17 de enero al 15 de febrero de 2026; se seleccionarán aproximadamente 10 propuestas, cada una con un estipendio entre 2,000 y 10,000 USD. No se requiere pago de inscripción para participar."
Italia,Convocatoria,Vivo Center: Res.Art Call for Young Contemporary Dance Choreographers 2025/26 (Italy),"Dirigida a jóvenes coreógrafos de danza contemporánea de entre 18 y 36 años, la convocatoria Vivo Center: Res.Art Call for Young Contemporary Dance Choreographers 2025/26 en Roma seleccionará seis artistas para residencias coreográficas de 10 días, donde crearán piezas con bailarines profesionales de la compañía VIVO FLYOUT; cada coreógrafo recibirá un pago de 600 euros que cubre viaje y alojamiento, y no se menciona ningún costo de inscripción para participar; la convocatoria está abierta a creadores internacionales, sin exclusión explícita para artistas de Latinoamérica, siempre que cumplan con la experiencia requerida (al menos una obra estrenada o publicada entre 2019 y 2023) y el rango de edad."
Múltiples Países,Residencia,"Inland: Pastoral Twilight Residency Programme 2026 (Spain, Czech Republic)","Dirigida a artistas, productores culturales e investigadores de cualquier nacionalidad interesados en prácticas vinculadas a lo rural y la vida en el campo, la residencia Inland: Pastoral Twilight Residency Programme 2026 (España, República Checa) cubre estipendio mensual, alojamiento y gastos de viaje para los seleccionados; no se menciona ningún pago de inscripción para participar. La oportunidad está abierta a diversas disciplinas artísticas y de investigación vinculadas al trabajo en el territorio, y se valoran especialmente perfiles con experiencia en entornos rurales; no hay restricción geográfica, por lo que pueden postular artistas latinoamericanos."
Uzbekistán,Oportunidad,ICCROM/NRICH: CollAsia 2025 Course on Sustainable Conservation of Heritage Collections (Uzbekistan),"Dirigida a profesionales que trabajan con colecciones patrimoniales (conservadores, gestores, restauradores, etc.) de cualquier nacionalidad, la ICCROM/NRICH: CollAsia 2025 Course on Sustainable Conservation of Heritage Collections (Uzbekistan) es un curso presencial y práctico que se desarrollará del 27 de octubre al 14 de noviembre de 2025 en museos de Uzbekistán, enfocado en la observación, documentación y diagnóstico de colecciones, promoviendo el pensamiento crítico y la colaboración interdisciplinar; no se especifica un pago de inscripción ni montos de apoyo económico para participantes, y la oportunidad está abierta a postulantes de todo el mundo, incluyendo América Latina, pero no se detallan ayudas financieras ni restricciones regionales en la información actualmente disponible."
Eslovenia,Oportunidad,"Inspiration Forum LAB: ‘Trajectories’ (Czech Republic, Slovenia, Slovakia, Online)","Inspiration Forum LAB: ‘Trajectories’ está dirigida a artistas y científicos de cualquier nacionalidad interesados en la colaboración interdisciplinaria para desarrollar proyectos multimedia de investigación en torno a movimientos y trayectorias ambientales, sociales y tecnológicas; no se especifica restricción geográfica, por lo que pueden postular artistas de Latinoamérica. La convocatoria no requiere pago de inscripción. El programa se centra en la investigación y colaboración, por lo que no se indica un monto económico estipulado para los participantes ni premios en efectivo; tampoco se mencionan ayudas específicas para gastos de viaje, producción o manutención. Las disciplinas involucradas son amplias e incluyen cualquier práctica artística y científica relacionada con los ejes temáticos propuestos."
Croacia,Residencia,Prostor: Curator-in-Residence Programme 2026 (Croatia),"Dirigida a curadores emergentes y de media carrera que sean residentes legales de países participantes en el programa Creative Europe (excluyendo Croacia), la residencia Prostor: Curator-in-Residence Programme 2026 en Split, Croacia, se desarrollará del 20 de agosto al 17 de septiembre de 2026. La convocatoria no requiere pago de inscripción y cubre hasta 300 EUR en gastos de viaje, alojamiento en el espacio de residencia, uso de estudio y coworking, un estipendio de 900 EUR para manutención y un presupuesto de producción de 1.000 EUR destinado a la exposición que organizará el curador invitado. La oportunidad está centrada en la curaduría contemporánea, con la posibilidad de invitar hasta cinco artistas a participar en la muestra resultante. No está abierta a artistas ni curadores de Latinoamérica, salvo que residan legalmente en un país de Creative Europe."
Reino Unido,Convocatoria,The ING Discerning Eye 2025,"La convocatoria The ING Discerning Eye 2025 está dirigida exclusivamente a artistas residentes en el Reino Unido, quienes pueden presentar obras de pequeño formato (máximo 50 cm en cualquier dimensión) en cualquier disciplina artística, incluyendo pintura, dibujo, escultura, grabado, fotografía, textil y medios mixtos. Todas las obras deben estar a la venta y serán seleccionadas por seis figuras destacadas del mundo del arte para ser exhibidas en la Mall Galleries de Londres. El certamen otorga un fondo total de premios de £13,000 a repartir entre los artistas seleccionados; los premios en ediciones anteriores incluyeron un primer premio de £5,000, otros premios principales de £2,500 y £1,000, así como premios menores de entre £200 y £1,500. La oportunidad no está abierta a artistas de Latinoamérica, ya que solo pueden participar quienes residan en el Reino Unido. No se especifica en la información disponible si existe un costo de inscripción para participar."
España,Convocatoria,Convocatoria Abierta: Residencias Artísticas Barce...,"Convocatoria dirigida a artistas de todo el mundo, sin restricción de edad ni nacionalidad, interesados en participar con obras de grabado realizadas mediante procesos de estampación tradicional; pueden presentarse hasta tres obras inéditas por artista. Es requisito abonar una cuota de inscripción (el monto específico no está detallado en las bases consultadas), y enviar las obras por correo postal certificado. Los premios consisten en una residencia artística de un mes en el taller de La Maldita Estampa para el primer premio (incluye uso de equipo, materiales y asesoría técnica, pero no alojamiento ni transporte), una residencia de dos semanas para el segundo premio bajo las mismas condiciones, y materiales de arte valorados en 300 euros para el tercer premio. La convocatoria está abierta a artistas latinoamericanos y de cualquier otra procedencia, siempre que cumplan con los requisitos técnicos y de envío."
Argentina,Premio,Premio Prilidiano Pueyrredón 2025,"Dirigido exclusivamente a estudiantes regulares de grado hasta el año 2024 y graduados/as entre 2020 y 2024 del Departamento de Artes Visuales “Prilidiano Pueyrredón” de la Universidad Nacional de las Artes, el Premio Prilidiano Pueyrredón 2025 busca promover y jerarquizar la producción artística en el campo de las artes visuales; no requiere pago de inscripción para participar. La convocatoria abarca únicamente disciplinas de artes visuales y otorga diplomas como único reconocimiento a los ganadores de las categorías estudiantes y graduados/as, sin estipulación de premios en dinero ni apoyo económico; la oportunidad no está abierta a artistas de Latinoamérica en general, sino restringida a quienes cumplan los requisitos académicos de la institución convocante."
Corea,Convocatoria,CICA Museum: Art in Action New York 2025,"Dirigida a artistas, performers, diseñadores y profesionales de campos creativos de cualquier nacionalidad, incluidos latinoamericanos, interesados en participar en el evento Art in Action New York 2025 organizado por CICA Museum; la convocatoria abarca disciplinas como artes visuales, performance, diseño y proyectos creativos experimentales. El evento es de un día, se realiza en Brooklyn, Nueva York, el 20 de diciembre de 2025, y cada seleccionado dispondrá de 20 minutos para presentar su obra en formato de charla, performance, presentación o taller, además de un espacio tipo booth para exhibir y vender obras, publicaciones u objetos de diseño. No se menciona ningún monto de dinero asignado a los artistas seleccionados ni se indica pago de inscripción para participar; tampoco se ofrece apoyo económico para viaje o producción. La oportunidad está abierta internacionalmente y contempla la posibilidad de que los participantes expongan también en una muestra grupal en el CICA Museum de Corea en diciembre de 2025, pero no se especifican beneficios económicos directos para los artistas."
Corea,Convocatoria,Abstract Mind 2026: the 11th International Exhibit...,"Dirigida a artistas de cualquier nacionalidad, incluyendo latinoamericanos, Abstract Mind 2026: the 11th International Exhibition on Abstract Art del CICA Museum convoca obras en pintura, dibujo, grabado, escultura, instalación, fotografía, arte digital 2D, video y arte interactivo que exploren la abstracción y conceptos abstractos; la participación no contempla un pago de inscripción, pero los artistas seleccionados deben asumir los gastos de envío y devolución de obras físicas, así como posibles costos adicionales si requieren impresión o montaje especial para obras digitales o mayores dimensiones; no se especifica monto de premio o remuneración para los artistas participantes ni compensación económica por exhibición, y la convocatoria está abierta hasta el 22 de agosto de 2025 con la muestra prevista del 15 de abril al 3 de mayo de 2026."
